{
  "schema_version": 1,
  "campaign_id": "qo-loss-campaign-v3",
  "status": "inconclusive",
  "metric": "robust_score",
  "direction": "maximize",
  "baseline": {
    "completed_seeds": 2,
    "required_seeds": 2,
    "mean_score": 0.763186,
    "runs": [
      {
        "run_id": "baseline-seed-17",
        "hypothesis_id": "baseline",
        "label": "Baseline",
        "seed": 17,
        "status": "completed",
        "score": 0.763186,
        "train_result": null,
        "eval_result": {
          "command": "bash eval.sh",
          "cwd": "examples/quantum_optics_open_exploration/.arenaforge/campaigns/qo-loss-campaign-v3/runs/baseline-seed-17/workspace",
          "returncode": 0,
          "duration_seconds": 0.672,
          "stdout_path": "logs/heldout_eval.stdout.log",
          "stderr_path": "logs/heldout_eval.stderr.log",
          "stdout_sha256": "05d337912d92c99e03f0ce82e98ae23489d6ced5c72a9cf10daa511b8b19bd37",
          "stderr_sha256": "b105123eb06f7c5c4cc630a98f2d78c86299f77a52a80d3d962cee82199b3e78",
          "timed_out": false
        },
        "protocol_violations": [],
        "workspace": "examples/quantum_optics_open_exploration/.arenaforge/campaigns/qo-loss-campaign-v3/runs/baseline-seed-17/workspace",
        "workspace_mode": "copy",
        "branch": null,
        "base_commit": null,
        "commit": null,
        "changed_paths": [],
        "diff_stat": ".",
        "code_ref": "729fe671ee1857627dfeb99a9c54935e36fab1fd"
      },
      {
        "run_id": "baseline-seed-27",
        "hypothesis_id": "baseline",
        "label": "Baseline",
        "seed": 27,
        "status": "completed",
        "score": 0.763186,
        "train_result": null,
        "eval_result": {
          "command": "bash eval.sh",
          "cwd": "examples/quantum_optics_open_exploration/.arenaforge/campaigns/qo-loss-campaign-v3/runs/baseline-seed-27/workspace",
          "returncode": 0,
          "duration_seconds": 0.672,
          "stdout_path": "logs/heldout_eval.stdout.log",
          "stderr_path": "logs/heldout_eval.stderr.log",
          "stdout_sha256": "05d337912d92c99e03f0ce82e98ae23489d6ced5c72a9cf10daa511b8b19bd37",
          "stderr_sha256": "ed882eb8851c5a6d2800b9e1f77f063f4f56238623d72c891e1933690b1c1605",
          "timed_out": false
        },
        "protocol_violations": [],
        "workspace": "examples/quantum_optics_open_exploration/.arenaforge/campaigns/qo-loss-campaign-v3/runs/baseline-seed-27/workspace",
        "workspace_mode": "copy",
        "branch": null,
        "base_commit": null,
        "commit": null,
        "changed_paths": [],
        "diff_stat": ".",
        "code_ref": "729fe671ee1857627dfeb99a9c54935e36fab1fd"
      }
    ]
  },
  "candidates": [
    {
      "hypothesis_id": "canonical-pytheus",
      "label": "PyTheus canonical topology",
      "claim": "The canonical high-fidelity topology remains the strongest under the declared transmission-loss sweep.",
      "status": "refuted",
      "completed_seeds": 2,
      "required_seeds": 2,
      "mean_score": 0.763186,
      "improvement": 0.0,
      "runs": [
        {
          "run_id": "canonical-pytheus-seed-17",
          "hypothesis_id": "canonical-pytheus",
          "label": "PyTheus canonical topology",
          "seed": 17,
          "status": "completed",
          "score": 0.763186,
          "train_result": {
            "command": "python -c \"from pathlib import Path; import json; Path('.arenaforge_candidate.json').write_text(json.dumps({'candidate_id': 'pytheus_canonical', 'prune_threshold': 0.0}) + '/n', encoding='utf-8')\"",
            "cwd": "examples/quantum_optics_open_exploration/.arenaforge/campaigns/qo-loss-campaign-v3/runs/canonical-pytheus-seed-17/workspace",
            "returncode": 0,
            "duration_seconds": 0.031,
            "stdout_path": "logs/train.stdout.log",
            "stderr_path": "logs/train.stderr.log",
            "stdout_sha256": "e3b0c44298fc1c149afbf4c8996fb92427ae41e4649b934ca495991b7852b855",
            "stderr_sha256": "e3b0c44298fc1c149afbf4c8996fb92427ae41e4649b934ca495991b7852b855",
            "timed_out": false
          },
          "eval_result": {
            "command": "bash eval.sh",
            "cwd": "examples/quantum_optics_open_exploration/.arenaforge/campaigns/qo-loss-campaign-v3/runs/canonical-pytheus-seed-17/workspace",
            "returncode": 0,
            "duration_seconds": 0.656,
            "stdout_path": "logs/heldout_eval.stdout.log",
            "stderr_path": "logs/heldout_eval.stderr.log",
            "stdout_sha256": "05d337912d92c99e03f0ce82e98ae23489d6ced5c72a9cf10daa511b8b19bd37",
            "stderr_sha256": "20cdc7014be6ef00290105806c439616aff07efd2f2eb923f2298912c71a5160",
            "timed_out": false
          },
          "protocol_violations": [],
          "workspace": "examples/quantum_optics_open_exploration/.arenaforge/campaigns/qo-loss-campaign-v3/runs/canonical-pytheus-seed-17/workspace",
          "workspace_mode": "copy",
          "branch": null,
          "base_commit": null,
          "commit": null,
          "changed_paths": [],
          "diff_stat": ".",
          "code_ref": null
        },
        {
          "run_id": "canonical-pytheus-seed-27",
          "hypothesis_id": "canonical-pytheus",
          "label": "PyTheus canonical topology",
          "seed": 27,
          "status": "completed",
          "score": 0.763186,
          "train_result": {
            "command": "python -c \"from pathlib import Path; import json; Path('.arenaforge_candidate.json').write_text(json.dumps({'candidate_id': 'pytheus_canonical', 'prune_threshold': 0.0}) + '/n', encoding='utf-8')\"",
            "cwd": "examples/quantum_optics_open_exploration/.arenaforge/campaigns/qo-loss-campaign-v3/runs/canonical-pytheus-seed-27/workspace",
            "returncode": 0,
            "duration_seconds": 0.031,
            "stdout_path": "logs/train.stdout.log",
            "stderr_path": "logs/train.stderr.log",
            "stdout_sha256": "e3b0c44298fc1c149afbf4c8996fb92427ae41e4649b934ca495991b7852b855",
            "stderr_sha256": "e3b0c44298fc1c149afbf4c8996fb92427ae41e4649b934ca495991b7852b855",
            "timed_out": false
          },
          "eval_result": {
            "command": "bash eval.sh",
            "cwd": "examples/quantum_optics_open_exploration/.arenaforge/campaigns/qo-loss-campaign-v3/runs/canonical-pytheus-seed-27/workspace",
            "returncode": 0,
            "duration_seconds": 0.656,
            "stdout_path": "logs/heldout_eval.stdout.log",
            "stderr_path": "logs/heldout_eval.stderr.log",
            "stdout_sha256": "05d337912d92c99e03f0ce82e98ae23489d6ced5c72a9cf10daa511b8b19bd37",
            "stderr_sha256": "82c7df276cde303006b08579ca5a08d36fc439b9fb2cc594e2fce083eee989e4",
            "timed_out": false
          },
          "protocol_violations": [],
          "workspace": "examples/quantum_optics_open_exploration/.arenaforge/campaigns/qo-loss-campaign-v3/runs/canonical-pytheus-seed-27/workspace",
          "workspace_mode": "copy",
          "branch": null,
          "base_commit": null,
          "commit": null,
          "changed_paths": [],
          "diff_stat": ".",
          "code_ref": null
        }
      ],
      "protocol_violations": [],
      "code_ref": null
    },
    {
      "hypothesis_id": "sparse-topology",
      "label": "Sparse edge pruning",
      "claim": "Removing weak edges may sacrifice a small amount of ideal fidelity while improving loss robustness.",
      "status": "refuted",
      "completed_seeds": 2,
      "required_seeds": 2,
      "mean_score": 0.739678,
      "improvement": -0.023508000000000084,
      "runs": [
        {
          "run_id": "sparse-topology-seed-17",
          "hypothesis_id": "sparse-topology",
          "label": "Sparse edge pruning",
          "seed": 17,
          "status": "completed",
          "score": 0.739678,
          "train_result": {
            "command": "python -c \"from pathlib import Path; import json; Path('.arenaforge_candidate.json').write_text(json.dumps({'candidate_id': 'sparse_edge_pruning', 'prune_threshold': 0.15}) + '/n', encoding='utf-8')\"",
            "cwd": "examples/quantum_optics_open_exploration/.arenaforge/campaigns/qo-loss-campaign-v3/runs/sparse-topology-seed-17/workspace",
            "returncode": 0,
            "duration_seconds": 0.047,
            "stdout_path": "logs/train.stdout.log",
            "stderr_path": "logs/train.stderr.log",
            "stdout_sha256": "e3b0c44298fc1c149afbf4c8996fb92427ae41e4649b934ca495991b7852b855",
            "stderr_sha256": "e3b0c44298fc1c149afbf4c8996fb92427ae41e4649b934ca495991b7852b855",
            "timed_out": false
          },
          "eval_result": {
            "command": "bash eval.sh",
            "cwd": "examples/quantum_optics_open_exploration/.arenaforge/campaigns/qo-loss-campaign-v3/runs/sparse-topology-seed-17/workspace",
            "returncode": 0,
            "duration_seconds": 0.672,
            "stdout_path": "logs/heldout_eval.stdout.log",
            "stderr_path": "logs/heldout_eval.stderr.log",
            "stdout_sha256": "7b1549d156f89cc1de31640d5173b120018c32b52baf597f9d3d2124016ea1aa",
            "stderr_sha256": "7d6bb900b9abaa1d2aeade4bbd2fa3d711299c9a6b82416a3a1b5c32e19f2a55",
            "timed_out": false
          },
          "protocol_violations": [],
          "workspace": "examples/quantum_optics_open_exploration/.arenaforge/campaigns/qo-loss-campaign-v3/runs/sparse-topology-seed-17/workspace",
          "workspace_mode": "copy",
          "branch": null,
          "base_commit": null,
          "commit": null,
          "changed_paths": [],
          "diff_stat": ".",
          "code_ref": null
        },
        {
          "run_id": "sparse-topology-seed-27",
          "hypothesis_id": "sparse-topology",
          "label": "Sparse edge pruning",
          "seed": 27,